{
  "category": "storm",
  "claims": [
    {
      "id": "claim-1",
      "retrieved_date": "2026-08-24",
      "source_name": "GDACS",
      "source_url": "https://www.gdacs.org/report.aspx?eventtype=TC&eventid=1001305",
      "text": "GDACS assessed Tropical Cyclone SAUDEL-26 at an Overall Orange alert (medium humanitarian impact), with peak sustained winds of 213 km/h (Category 4) and approximately 3.5 million people exposed to Category 1 (120 km/h) or higher winds across the Northern Mariana Islands, Japan and China; the event window runs 18-24 August 2026, with a maximum storm surge forecast for 27 August 2026 at 17:00 UTC.",
      "verification_status": "verified"
    },
    {
      "id": "claim-2",
      "retrieved_date": "2026-08-26",
      "source_name": "GDACS",
      "source_url": "https://www.gdacs.org/report.aspx?eventtype=TC&eventid=1001305",
      "text": "GDACS's tropical cyclone report for SAUDEL-26 (active from 18 August to 26 August 2026) rates the storm an overall Green alert -- 'a low humanitarian impact based on the maximum sustained wind speed, exposed population and vulnerability' -- with maximum sustained winds of '213 km/h Category 4', approximately 280,000 people in Category 1 or higher wind zones across Japan and the Northern Mariana Islands, and a maximum storm surge of 1.8 metres.",
      "verification_status": "verified"
    },
    {
      "id": "claim-3",
      "retrieved_date": "2026-08-27",
      "source_name": "GDACS",
      "source_url": "https://www.gdacs.org/report.aspx?eventtype=TC&eventid=1001305",
      "text": "GDACS's event-data API (episode 36) for SAUDEL-26 records an overall Orange alert with the event window extended to 18 August 2026 12:00 UTC - 27 August 2026 06:00 UTC, unchanged maximum sustained winds of 213 km/h (Category 4), about 11.5 million people exposed to Category 1 or higher winds across Japan, China and the Northern Mariana Islands, and a maximum storm surge of 2.3 metres (forecast for 28 August 00:00 UTC).",
      "verification_status": "verified"
    },
    {
      "id": "claim-4",
      "retrieved_date": "2026-08-28",
      "source_name": "GDACS",
      "source_url": "https://www.gdacs.org/report.aspx?eventtype=TC&eventid=1001305",
      "text": "GDACS's tropical cyclone report for SAUDEL-26 (episode 39, reporting window 18 Aug 2026 12:00 UTC to 28 Aug 2026 00:00 UTC) shows the event's urgency status now 'Past', with no further episode issued since the window closed; the overall alert remained Orange, maximum sustained winds were unchanged at 213 km/h (Category 4), approximately 13.1 million people were exposed to Category 1 or higher winds across Japan, China and the Northern Mariana Islands (up from about 11.5 million), and a maximum storm surge of 2.7 metres was recorded on 27 August 2026 at 23:00 UTC.",
      "verification_status": "verified"
    }
  ],
  "description": "Tropical Cyclone Saudel intensified to Category 4 strength (213 km/h sustained winds) in the Philippine Sea in mid-August 2026, tracking through the Northern Mariana Islands toward Japan's Ryukyu Islands, Taiwan and China. GDACS's alert level oscillated between Green and Orange as the storm's track evolved, reaching a peak assessed exposure of about 13.1 million people across Japan, China and the Northern Mariana Islands and a maximum storm surge of 2.7 metres on 27 August. GDACS's final episode for the storm (episode 39) closed at 00:00 UTC on 28 August 2026, with the event's urgency status now marked Past and no further episode issued. No death, injury or displacement figure has been confirmed by an authoritative source.",
  "event": {
    "impact": {
      "deaths": null,
      "displaced": null,
      "summary": "GDACS's tropical cyclone report for SAUDEL-26 closed its final episode (episode 39) at 00:00 UTC on 28 August 2026, with the event's urgency status now marked Past. Over its track the storm reached Category 4 intensity (213 km/h sustained winds), exposed an estimated 13.1 million people to Category 1 or higher winds across Japan, China and the Northern Mariana Islands (up from about 11.5 million on 27 August), and produced a maximum storm surge of 2.7 metres on 27 August. No death, injury or displacement figure has been confirmed by an authoritative source."
    },
    "live_source_url": "https://www.gdacs.org/report.aspx?eventtype=TC&eventid=1001305",
    "location": {
      "country": "Japan",
      "lat": 23.9,
      "lon": 136.3,
      "region": "Ryukyu Islands (Okinawa / Amami Ōshima), extending to Taiwan and China"
    },
    "occurrence_date": "2026-08-18",
    "scale": "Category 4 peak (213 km/h); GDACS episode closed (urgency Past) 28 August 2026, Orange alert",
    "status": "contained"
  },
  "id": "typhoon-saudel-2026",
  "last_updated": "2026-08-28T09:22:52Z",
  "name": "Typhoon Saudel — Northern Mariana Islands, Japan & China",
  "provenance": {
    "history": [
      {
        "at": "2026-08-28T09:22:52Z",
        "layer": "verify",
        "run_id": "2026-08-28T09-22-52Z-c01bea"
      }
    ],
    "last_layer": "verify",
    "last_run_id": "2026-08-28T09-22-52Z-c01bea"
  },
  "schema_version": "1.0",
  "sort_keys": {
    "composite": 7398461.0,
    "impact_rank": 1,
    "recency_rank": 739846
  },
  "updates": [
    {
      "date": "2026-08-28",
      "text": "GDACS's episode window for SAUDEL-26 closed at 00:00 UTC on 28 August, with the event's urgency status now marked Past and no further episode issued; exposed population rose to about 13.1 million people (from about 11.5 million) and maximum storm surge to 2.7 m (27 August, 23:00 UTC), with maximum sustained winds unchanged at 213 km/h Category 4."
    },
    {
      "date": "2026-08-27",
      "text": "GDACS re-escalated SAUDEL-26 from Green back to an overall Orange alert as its episode window extended to 27 August, with exposed population rising to about 11.5 million people across Japan, China and the Northern Mariana Islands (from about 280,000) and a forecast maximum storm surge of 2.3 m."
    },
    {
      "date": "2026-08-26",
      "text": "GDACS lowered SAUDEL-26 to an overall Green alert (low humanitarian impact) for its 18-26 August track, with about 280,000 people in Category 1 or higher wind zones across Japan and the Northern Mariana Islands (from about 3.5 million at the 24 August Orange assessment) and a maximum storm surge of 1.8 m."
    }
  ],
  "verification": {
    "confidence": "high",
    "notes": "gate: 4 verified, 0 disputed, 0 unverified -> verified",
    "status": "verified"
  }
}
