{
  "category": "volcanic",
  "claims": [
    {
      "id": "claim-1",
      "retrieved_date": "2026-10-27",
      "source_name": "GDACS",
      "source_url": "https://gdacs.org/report.aspx?eventid=1000148&episodeid=2&eventtype=VO",
      "text": "GDACS's report for this event (event ID VO 1000148) rates the Krakatau eruption an Orange alert, \"unlikely to require external humanitarian assistance based on the exposed population and coping capacity,\" with about 2,000 people within 30km and no people affected within 100km; it records a Volcanic Explosivity Index of 6 for the episode, running from 04 Sep 2026 21:00 UTC to 05 Sep 2026 14:30 UTC.",
      "verification_status": "verified"
    },
    {
      "id": "claim-2",
      "retrieved_date": "2026-09-15",
      "source_name": "Badan Geologi / PVMBG (Indonesia)",
      "source_url": "https://geologi.esdm.go.id/media-center/perkembangan-erupsi-gunungapi-anak-krakatau-tanggal-7-september-2026",
      "text": "Indonesia's Badan Geologi (PVMBG), in its update on Gunung Anak Krakatau dated 7 September 2026, states the volcano's activity level remains at Level III / Siaga (\"tingkat aktivitas G. Anak Krakatau tetap pada Level III (Siaga)\"), maintains the 3km exclusion zone around the volcano's center barring residents and visitors/tourists/climbers from entering (\"radius 3 km dari pusat aktivitas G. Anak Krakatau\"), records 3 Strombolian eruptions after the continuous eruption episode ended (\"3 kali erupsi Strombolian terjadi setelah episode erupsi menerus berakhir\") alongside 9 emission and 93 low-frequency earthquakes, and assesses that \"the probability of an eruption occurring in the coming period is still high\" (\"Probabilitas untuk terjadi letusan dalam beberapa periode waktu selanjutnya adalah masih tinggi\").",
      "verification_status": "verified"
    },
    {
      "id": "claim-3",
      "retrieved_date": "2026-09-21",
      "source_name": "Badan Geologi / PVMBG (Indonesia)",
      "source_url": "https://geologi.esdm.go.id/media-center/perkembangan-erupsi-gunungapi-anak-krakatau-tanggal-11-september-2026",
      "text": "Indonesia's Badan Geologi (PVMBG), in its update on Gunung Anak Krakatau dated 11 September 2026 (evaluation as of 06:00 WIB), states the volcano's activity level remains at Level III / Siaga (\"tingkat aktivitas G. Anak Krakatau tetap pada Level III (Siaga)\") with the 3km exclusion zone unchanged, and records 14 Strombolian eruptions since the continuous eruption episode ended (\"telah terjadi 14 kali erupsi Strombolian\"), up from 3 as of 7 September; it assesses the probability of a further eruption in the coming period as still high, and notes deep volcanic earthquakes show an increasing trend while shallow volcanic seismicity is fluctuating with a declining tendency.",
      "verification_status": "verified"
    },
    {
      "id": "claim-4",
      "retrieved_date": "2026-10-26",
      "source_name": "Badan Geologi / PVMBG (Indonesia)",
      "source_url": "http://geologi.esdm.go.id/media-center/laporan-khusus-penurunan-tingkat-aktivitas-gunungapi-anak-krakatau-provinsi-lampung-dari-level-iii-siaga-menjadi-level-ii-waspada-tanggal-21-september-2026-pukul-18-30-wib",
      "text": "Indonesia's Badan Geologi (PVMBG), in a Special Report (Laporan Khusus) dated 21 September 2026, downgraded Gunung Anak Krakatau's activity level from Level III (Siaga) to Level II (Waspada), effective 21 September 2026 at 18:30 WIB (\"terhitung mulai tanggal 21 September 2026 pukul 18.30 WIB\"), and reduced the exclusion zone from 3km to 2km from the volcano's center (\"tidak diperbolehkan memasuki dan melakukan kegiatan di dalam wilayah radius 2 km\"). It cites declining seismicity on 20 September (\"1 kali Gempa Low Frequency dan Tremor Menerus dengan rata rata amplitudo 2 mm\") and a deflation trend in deformation monitoring supporting the downgrade, and asks residents of the Banten and Lampung coasts to stay calm and not believe rumors of an eruption (\"jangan mempercayai isu-isu tentang erupsi\").",
      "verification_status": "verified"
    },
    {
      "id": "claim-5",
      "retrieved_date": "2026-10-22",
      "source_name": "Detik",
      "source_url": "https://news.detik.com/berita/d-8702424/gunung-anak-krakatau-level-siaga-warga-dilarang-mendekat-radius-5-km",
      "text": "Detik.com's report (published 11 October 2026, 18:53 WIB, observation window 12:00-18:00 WIB and attributed to PVMBG observer Muhammad Dika Nurzaman) states Gunung Anak Krakatau remains at Alert Level III (Siaga), with a mandatory exclusion zone of 5km from the eruption center plus 1km around new islands in the northwest and southeast sectors. Multiple other Indonesian outlets (Kompas, Warta Ekonomi, IDN Times, RRI) separately report Badan Geologi/PVMBG raised the volcano from Level II (Waspada) back to Level III effective 9 October 2026, 21:00 WIB, citing report number 1729.Lap/GL.03/BGL/2026 and a cluster of 13 eruptions recorded by 21:20 WIB that evening, following a run of eruptions on 5 and 8 October while the volcano was still at Level II; none of these figures have been independently confirmed via Badan Geologi's own geologi.esdm.go.id site, which did not return the relevant bulletin to direct requests during this check.",
      "verification_status": "unverified"
    }
  ],
  "description": "Indonesia's Krakatau volcano, in the Sunda Strait, began a high-level eruption on 4 September 2026 that GDACS rated a VEI 6 event under an Orange alert. Indonesia's Badan Geologi (PVMBG) downgraded the volcano from Alert Level III (Siaga) to Level II (Waspada) on 21 September, but widespread Indonesian press reporting says PVMBG raised it back to Level III on 9 October 2026 after a fresh cluster of eruptions, widening the exclusion zone to 5km around the crater plus 1km around new islands to the northwest and southeast; as of 11 October, press reports placed the volcano still at Level III under this expanded zone. This renewed upgrade has not yet been corroborated on Badan Geologi's own geologi.esdm.go.id site.",
  "event": {
    "impact": {
      "deaths": null,
      "displaced": null,
      "summary": "No casualty or displacement figures have been published by an authoritative source. Indonesian press (Kompas, Detik, Warta Ekonomi, IDN Times, RRI) widely report Badan Geologi (PVMBG) raised Gunung Anak Krakatau from Level II (Waspada) back to Level III (Siaga) effective 9 October 2026, 21:00 WIB, after a cluster of eruptions, and widened the exclusion zone from 2km to 5km around the crater plus 1km around new islands to the northwest and southeast, with the volcano still reported at Level III as of 11 October; this has not yet been directly corroborated on Badan Geologi's own geologi.esdm.go.id site."
    },
    "live_source_url": "https://gdacs.org/report.aspx?eventid=1000148&eventtype=VO",
    "location": {
      "country": "Indonesia",
      "lat": -6.1,
      "lon": 105.42,
      "region": "Sunda Strait (Lampung / Banten provinces)"
    },
    "occurrence_date": "2026-09-04",
    "scale": "VEI 6; GDACS Orange alert; press reports Level III since 9 Oct",
    "status": "ongoing"
  },
  "id": "indonesia-volcano-krakatau-2026",
  "last_updated": "2026-10-27T09:09:30Z",
  "name": "Volcanic Eruption — Krakatau, Indonesia",
  "provenance": {
    "history": [
      {
        "at": "2026-10-27T09:09:30Z",
        "layer": "verify",
        "run_id": "2026-10-27T09-09-30Z-ae72d3"
      }
    ],
    "last_layer": "verify",
    "last_run_id": "2026-10-27T09-09-30Z-ae72d3"
  },
  "schema_version": "1.0",
  "sort_keys": {
    "composite": 7398631.0,
    "impact_rank": 1,
    "recency_rank": 739863
  },
  "updates": [
    {
      "date": "2026-10-17",
      "text": "Indonesian press widely report Badan Geologi (PVMBG) raised Gunung Anak Krakatau from Level II (Waspada) back to Level III (Siaga) effective 9 October 2026, 21:00 WIB, after a cluster of eruptions, widening the exclusion zone from 2km to 5km plus 1km around new islands; still reported at Level III as of 11 October, though not yet corroborated on PVMBG's own site."
    },
    {
      "date": "2026-09-21",
      "text": "Indonesia's Badan Geologi (PVMBG) downgraded Gunung Anak Krakatau from Alert Level III (Siaga) to Level II (Waspada), effective 21 September 2026 18:30 WIB, citing declining seismicity and a deflation trend in ground deformation, and reduced the mandatory exclusion zone from 3km to 2km around the crater."
    },
    {
      "date": "2026-09-16",
      "text": "Indonesia's Badan Geologi (PVMBG) reported 14 Strombolian eruptions since the continuous episode ended, as of 11 September, up from 3 recorded on 7 September; the volcano remains at Alert Level III (Siaga) with the 3km exclusion zone unchanged, and the probability of a further eruption remains assessed as high."
    },
    {
      "date": "2026-09-07",
      "text": "Indonesia's Badan Geologi (PVMBG) confirmed the volcano remains at Alert Level III (Siaga) with a 3km exclusion zone as of 7 September, following three Strombolian eruptions after the initial 25-hour continuous episode ended, and assessed the probability of a further eruption in the coming period as still high."
    }
  ],
  "verification": {
    "confidence": "medium",
    "notes": "gate: 4 verified, 0 disputed, 1 unverified -> partial",
    "status": "partial"
  }
}
