{
  "category": "wildfire",
  "claims": [
    {
      "id": "claim-1",
      "retrieved_date": "2026-08-04",
      "source_name": "GDACS",
      "source_url": "https://www.gdacs.org/report.aspx?eventtype=WF&eventid=1029987",
      "text": "GDACS assessed an Orange alert for a forest fire in Greece covering the period 31 July-4 August 2026, citing approximately 18,299 hectares burned and about 1,648 people in the fire-affected area, noting the fire \"can have a medium humanitarian impact based on the burned area and the affected population and their vulnerability.\"",
      "verification_status": "verified"
    }
  ],
  "description": "A wildfire broke out on 31 July 2026 near Psatha and Porto Germeno in western Attica, west of Athens, amid a European heatwave, spreading rapidly under strong winds and prompting evacuations and sea rescues along the coast. GDACS assessed an Orange alert for medium humanitarian impact, citing about 18,299 hectares burned and roughly 1,648 people in the fire-affected area as of 4 August 2026. No allowlisted authoritative source has published a confirmed death toll for this fire; international media reported firefighters and helicopter crew killed during the response, but this remains unconfirmed by an allowlisted source.",
  "event": {
    "impact": {
      "deaths": null,
      "displaced": null,
      "summary": "GDACS's event report (eventid 1029987, GLIDE WF-2026-000142-GRC, episode 15) assessed an Orange alert for medium humanitarian impact for a forest fire burning in western Attica, Greece, covering a 31 July-4 August 2026 window, citing about 18,299 hectares burned and roughly 1,648 people in the fire-affected area. No allowlisted authoritative source has published a confirmed death toll or evacuation count, and no source has declared the fire contained."
    },
    "live_source_url": "https://www.gdacs.org/report.aspx?eventtype=WF&eventid=1029987",
    "location": {
      "country": "Greece",
      "lat": 38.15,
      "lon": 23.2,
      "region": "Western Attica (Psatha, Porto Germeno), west of Athens"
    },
    "occurrence_date": "2026-07-31",
    "scale": "Orange alert; ~18,299 ha burned",
    "status": "ongoing"
  },
  "id": "greece-wildfire-attica-2026",
  "last_updated": "2026-08-04T09:10:50Z",
  "name": "Wildfire — Western Attica, Greece",
  "provenance": {
    "history": [
      {
        "at": "2026-08-04T09:10:50Z",
        "layer": "verify",
        "run_id": "2026-08-04T09-10-50Z-899311"
      }
    ],
    "last_layer": "verify",
    "last_run_id": "2026-08-04T09-10-50Z-899311"
  },
  "schema_version": "1.0",
  "sort_keys": {
    "composite": 7398281.0,
    "impact_rank": 1,
    "recency_rank": 739828
  },
  "verification": {
    "confidence": "high",
    "notes": "gate: 1 verified, 0 disputed, 0 unverified -> verified",
    "status": "verified"
  }
}
