{
  "category": "wildfire",
  "claims": [
    {
      "id": "claim-1",
      "retrieved_date": "2026-07-20",
      "source_name": "GDACS",
      "source_url": "https://www.gdacs.org/report.aspx?eventid=1029489&episodeid=3&eventtype=WF",
      "text": "GDACS assessed an Orange alert for a forest fire in Fontainebleau, France covering the period 12-14 July 2026, citing approximately 2,280 hectares burned and about 814 people exposed in the fire-affected area, noting the fire \"can have a medium humanitarian impact based on the burned area and the affected population and their vulnerability.\"",
      "verification_status": "verified"
    },
    {
      "id": "claim-2",
      "retrieved_date": "2026-07-20",
      "source_name": "European Union",
      "source_url": "https://eu-space.europa.eu/components/earth-observation-copernicus/image-of-the-day/wildfire-burns-fontainebleau-forest-france",
      "text": "EU Copernicus Earth observation imagery confirmed a wildfire spreading through part of Fontainebleau Forest, Seine-et-Marne, France starting 12 July 2026, with more than 800 hectares burned as of 13 July 2026, prompting evacuations and disrupting transportation services in the region.",
      "verification_status": "verified"
    }
  ],
  "description": "A wildfire broke out in Fontainebleau Forest, Seine-et-Marne, southeast of Paris, on 12 July 2026, spreading rapidly amid a European heatwave before being brought under control within about two days. GDACS assessed an Orange alert for medium humanitarian impact, citing about 2,280 hectares burned and roughly 814 people exposed in the fire-affected area over 12-14 July; EU Copernicus imagery measured more than 800 hectares burned as of 13 July. The fire prompted evacuations and disrupted nearby road and rail services; no deaths have been reported.",
  "event": {
    "impact": {
      "deaths": null,
      "displaced": null,
      "summary": "GDACS assessed an Orange alert (medium humanitarian impact) for the wildfire that burned in Fontainebleau Forest, Seine-et-Marne between 12 and 14 July 2026, citing about 2,280 hectares burned and roughly 814 people exposed; EU Copernicus imagery separately measured more than 800 hectares burned as of 13 July. The fire prompted evacuations and disrupted nearby road and rail services before being brought under control; no deaths and no confirmed evacuation count have been reported."
    },
    "live_source_url": "https://www.gdacs.org/report.aspx?eventid=1029489&episodeid=3&eventtype=WF",
    "location": {
      "country": "France",
      "lat": 48.4042,
      "lon": 2.7016,
      "region": "Fontainebleau Forest, Seine-et-Marne (SE of Paris)"
    },
    "occurrence_date": "2026-07-12",
    "scale": "Orange alert; ~2,280 ha burned",
    "status": "contained"
  },
  "id": "france-wildfire-fontainebleau-2026",
  "last_updated": "2026-08-19T13:04:07Z",
  "name": "Wildfire — Fontainebleau Forest, France",
  "provenance": {
    "history": [
      {
        "at": "2026-07-20T09:21:35Z",
        "layer": "verify",
        "run_id": "2026-07-20T09-21-35Z-95a24a"
      },
      {
        "at": "2026-08-19T13:04:07Z",
        "layer": "verify",
        "run_id": "2026-08-19T13-04-07Z-52afc4"
      }
    ],
    "last_layer": "verify",
    "last_run_id": "2026-08-19T13-04-07Z-52afc4"
  },
  "schema_version": "1.0",
  "sort_keys": {
    "composite": 7398091.0,
    "impact_rank": 1,
    "recency_rank": 739809
  },
  "verification": {
    "confidence": "high",
    "notes": "gate: 2 verified, 0 disputed, 0 unverified -> verified",
    "status": "verified"
  }
}
