{
  "category": "wildfire",
  "claims": [
    {
      "id": "claim-1",
      "retrieved_date": "2026-07-25",
      "source_name": "GDACS",
      "source_url": "https://www.gdacs.org/report.aspx?eventid=1029628&episodeid=1&eventtype=WF",
      "text": "Overall Green Forest fire in France from 22 Jul 2026 00:00 UTC to 23 Jul 2026 00:00 UTC. Forest fire can have a low humanitarian impact based on the burned area and the affected population and their vulnerability. About 6,769 hectares burned and roughly 2,984 people in the affected area.",
      "verification_status": "verified"
    },
    {
      "id": "claim-10",
      "retrieved_date": "2026-08-02",
      "source_name": "GDACS",
      "source_url": "https://www.gdacs.org/report.aspx?eventid=1029628&eventtype=WF",
      "text": "GDACS event report (eventid 1029628), re-checked 2 August 2026: window now extends from 22 Jul 2026 00:00 UTC to 01 Aug 2026 00:00 UTC, citing about 47,910 hectares burned and 11,670 people in the fire-affected area — essentially unchanged from 47,913 hectares/11,670 people as of episode 30 (31 July), with the most recent thermal-anomaly detection now 1 August 2026. Alert level remains Red.",
      "verification_status": "verified"
    },
    {
      "id": "claim-11",
      "retrieved_date": "2026-08-04",
      "source_name": "GDACS",
      "source_url": "https://www.gdacs.org/report.aspx?eventid=1029628&episodeid=30&eventtype=WF",
      "text": "GDACS event report (eventid 1029628, episode 30), re-checked 4 August 2026: still shows the 22 Jul-1 Aug 2026 window as the latest, with no newer episode published and the most recent thermal-anomaly detection unchanged at 1 August 2026 — three days with no new hotspot activity. Burned area and affected population remain 47,913 hectares and 11,670 people.",
      "verification_status": "verified"
    },
    {
      "id": "claim-2",
      "retrieved_date": "2026-07-25",
      "source_name": "GDACS",
      "source_url": "https://www.gdacs.org/report.aspx?eventid=1029628&episodeid=8&eventtype=WF",
      "text": "GDACS event report (eventid 1029628, episode 8): forest fire in France covering a 22-25 July 2026 window, citing about 25,692 hectares burned and roughly 9,447 people in the fire-affected area, assessed as low humanitarian impact based on burned area and affected population.",
      "verification_status": "verified"
    },
    {
      "id": "claim-3",
      "retrieved_date": "2026-07-26",
      "source_name": "GDACS",
      "source_url": "https://www.gdacs.org/report.aspx?eventid=1029628&episodeid=13&eventtype=WF",
      "text": "GDACS event report (eventid 1029628, episode 13): forest fire in France covering a 22-26 July 2026 window, citing about 34,056 hectares burned and roughly 10,350 people in the fire-affected area, with the most recent thermal-anomaly detection on 26 July 2026; still assessed as low (Green) humanitarian impact.",
      "verification_status": "verified"
    },
    {
      "id": "claim-4",
      "retrieved_date": "2026-07-27",
      "source_name": "GDACS",
      "source_url": "https://www.gdacs.org/report.aspx?eventid=1029628&episodeid=16&eventtype=WF",
      "text": "GDACS event report (eventid 1029628, episode 16): forest fire in France covering a 22-27 July 2026 window, citing about 45,290 hectares burned and roughly 11,606 people in the fire-affected area, with the most recent thermal-anomaly detection on 27 July 2026; still assessed as low (Green) humanitarian impact.",
      "verification_status": "verified"
    },
    {
      "id": "claim-5",
      "retrieved_date": "2026-07-28",
      "source_name": "GDACS",
      "source_url": "https://www.gdacs.org/report.aspx?eventid=1029628&episodeid=19&eventtype=WF",
      "text": "GDACS event report (eventid 1029628, episode 19): Overall Red alert for a forest fire in France covering a 22-27 July 2026 window, citing 45,805 hectares burned and 11,643 people in the fire-affected area, with the most recent thermal-anomaly detection on 27 July 2026 — up from Green alert / 45,290 hectares / 11,606 people as of episode 16 (27 July).",
      "verification_status": "verified"
    },
    {
      "id": "claim-6",
      "retrieved_date": "2026-07-29",
      "source_name": "GDACS",
      "source_url": "https://www.gdacs.org/report.aspx?eventid=1029628&episodeid=22&eventtype=WF",
      "text": "GDACS event report (eventid 1029628, episode 22): Overall Red alert for a forest fire in France covering a 22-29 July 2026 window, citing 47,593 hectares burned and 11,669 people in the fire-affected area, with the most recent thermal-anomaly detection on 29 July 2026 — up from 45,805 hectares/11,643 people as of episode 19 (27 July).",
      "verification_status": "verified"
    },
    {
      "id": "claim-7",
      "retrieved_date": "2026-07-30",
      "source_name": "GDACS",
      "source_url": "https://www.gdacs.org/report.aspx?eventid=1029628&episodeid=26&eventtype=WF",
      "text": "GDACS event report (eventid 1029628, episode 26), generated 30 Jul 2026 00:00 UTC: Overall Red alert for a forest fire in France, citing 47,871 hectares burned and 11,670 people in the fire-affected area, with the most recent thermal-anomaly detection on 30 July 2026 — up from 47,593 hectares/11,669 people as of episode 22 (29 July).",
      "verification_status": "verified"
    },
    {
      "id": "claim-8",
      "retrieved_date": "2026-07-31",
      "source_name": "GDACS",
      "source_url": "https://www.gdacs.org/report.aspx?eventid=1029628&episodeid=28&eventtype=WF",
      "text": "GDACS event report (eventid 1029628, episode 28), generated 30 Jul 2026 00:00 UTC: Overall Red alert for a forest fire in France, citing 47,895 hectares burned and 11,670 people in the fire-affected area, with the most recent thermal-anomaly detection on 30 July 2026 — up slightly from 47,871 hectares/11,670 people as of episode 26 (30 July).",
      "verification_status": "verified"
    },
    {
      "id": "claim-9",
      "retrieved_date": "2026-08-01",
      "source_name": "GDACS",
      "source_url": "https://www.gdacs.org/report.aspx?eventid=1029628&episodeid=30&eventtype=WF",
      "text": "GDACS event report (eventid 1029628, episode 30), generated 31 Jul 2026: Overall Red alert for a forest fire in France, citing 47,913 hectares burned and 11,670 people in the fire-affected area, with the most recent thermal-anomaly detection on 31 July 2026 — up slightly from 47,895 hectares/11,670 people as of episode 28 (30 July).",
      "verification_status": "verified"
    }
  ],
  "description": "A fast-moving wildfire broke out in the Gironde department of southwestern France on 22 July 2026 and spread rapidly toward Bordeaux amid extreme heat and strong winds, prompting evacuation orders for suburbs on the city's western edge, including areas near its airport. GDACS escalated its alert from Green to Red as of episode 19 (27 July 2026) and the burned area reached about 47,910-47,913 hectares with roughly 11,670 people in the fire-affected area by 1 August 2026. No newer GDACS episode has been published and no thermal-anomaly detection has been recorded since 1 August 2026, indicating the fire is now contained. Widely reported figures — evacuations variously put at around 110,000 to 320,000+ people, French military mobilisation ordered by President Macron, and activation of the EU Civil Protection Mechanism — have not been confirmed by an allowlisted authoritative source.",
  "event": {
    "impact": {
      "deaths": null,
      "displaced": null,
      "summary": "GDACS's event report (eventid 1029628, episode 30) keeps this forest fire in France at an Overall Red alert, with the reporting window ending 1 August 2026 and about 47,913 hectares burned and 11,670 people in the fire-affected area. Re-checked 4 August 2026: no episode newer than 30 has been published and no thermal-anomaly detection has been recorded since 1 August 2026 — three days with no new hotspot activity — indicating the fire is now contained. No allowlisted authoritative source has published a confirmed death toll or evacuation count for this fire; widely reported figures of 110,000-320,000+ people evacuated, French military mobilisation, and EU Civil Protection Mechanism activation come from non-allowlisted media and have not been independently confirmed here."
    },
    "live_source_url": "https://www.gdacs.org/report.aspx?eventid=1029628&episodeid=30&eventtype=WF",
    "location": {
      "country": "France",
      "lat": 44.7,
      "lon": -0.95,
      "region": "Gironde department (near Bordeaux and the Landes border)"
    },
    "occurrence_date": "2026-07-22",
    "scale": "GDACS Red alert; ~47,900 ha burned",
    "status": "contained"
  },
  "id": "france-wildfire-gironde-2026",
  "last_updated": "2026-08-04T09:20:04Z",
  "name": "Wildfire — Gironde (Bordeaux), France",
  "provenance": {
    "history": [
      {
        "at": "2026-08-04T09:20:04Z",
        "layer": "verify",
        "run_id": "2026-08-04T09-20-04Z-b5fa8c"
      }
    ],
    "last_layer": "verify",
    "last_run_id": "2026-08-04T09-20-04Z-b5fa8c"
  },
  "schema_version": "1.0",
  "sort_keys": {
    "composite": 7398191.0,
    "impact_rank": 1,
    "recency_rank": 739819
  },
  "verification": {
    "confidence": "high",
    "notes": "gate: 11 verified, 0 disputed, 0 unverified -> verified",
    "status": "verified"
  }
}
